[
  {
    "id": "action-8dec4025df8d",
    "owner": "Hermes",
    "action": "Retry a local prospect during business hours",
    "priority": "high",
    "score": 127.53,
    "due_at": "10:00 ET next business day",
    "reason": "After-hours call hit a closed-office flow; the assistant said it would try again during business hours.",
    "expected_revenue_path": "Better contact → reply or booked call → home-service follow-up starter sale",
    "evidence_link": "private-source-redacted",
    "status": "open",
    "source_entity_type": "prospect",
    "source_entity_id": "prospect-b09e25c57562",
    "source_paths": [
      "private-source-redacted"
    ],
    "generated_at": "2026-07-09T08:37:42Z",
    "source_hashes": {}
  },
  {
    "id": "action-70e788ae45f4",
    "owner": "Matthew",
    "action": "Send a short email fallback after voicemail",
    "priority": "high",
    "score": 91.17,
    "due_at": "next business day",
    "reason": "Voicemail was reached; the report says the AI offered to have Matthew send one short email.",
    "expected_revenue_path": "Better contact → reply or booked call → home-service follow-up starter sale",
    "evidence_link": "private-source-redacted",
    "status": "open",
    "source_entity_type": "prospect",
    "source_entity_id": "prospect-92357942333d",
    "source_paths": [
      "private-source-redacted"
    ],
    "generated_at": "2026-07-09T08:37:42Z",
    "source_hashes": {}
  },
  {
    "id": "action-16ea73256613",
    "owner": "Hermes",
    "action": "Verify public CRM redaction before any GitHub Pages publishing",
    "priority": "high",
    "score": 72,
    "due_at": "before public publish",
    "reason": "The CRM contains prospect data and call evidence; public output must prove that sensitive fields are removed.",
    "expected_revenue_path": "Protect trust and keep public status useful without leaking prospect/campaign details",
    "evidence_link": "private-source-redacted",
    "status": "open",
    "source_entity_type": "asset",
    "source_entity_id": "policy-vapi-cost-control",
    "source_paths": [
      "private-source-redacted"
    ],
    "generated_at": "2026-07-09T08:37:42Z",
    "source_hashes": {}
  },
  {
    "id": "action-cd3c37d1ecf4",
    "owner": "Hermes",
    "action": "Call a local owner-operated prospect in the business-hours batch",
    "priority": "medium",
    "score": 65.81,
    "due_at": "10:00 ET next business day",
    "reason": "Owner-operated local prospects are the best next segment after large-company IVR failures.",
    "expected_revenue_path": "Better contact → reply or booked call → home-service follow-up starter sale",
    "evidence_link": "private-source-redacted",
    "status": "open",
    "source_entity_type": "prospect",
    "source_entity_id": "prospect-1e0e4aac9212",
    "source_paths": [
      "private-source-redacted"
    ],
    "generated_at": "2026-07-09T08:37:42Z",
    "source_hashes": {}
  },
  {
    "id": "action-992012b27319",
    "owner": "Both",
    "action": "Prepare a direct follow-up angle for a reached prospect",
    "priority": "low",
    "score": 42.0,
    "due_at": "this week",
    "reason": "The first batch reached a live agent but failed to qualify before the call ended.",
    "expected_revenue_path": "Better contact → reply or booked call → home-service follow-up starter sale",
    "evidence_link": "private-source-redacted",
    "status": "open",
    "source_entity_type": "prospect",
    "source_entity_id": "prospect-9e962a58ad1c",
    "source_paths": [
      "private-source-redacted"
    ],
    "generated_at": "2026-07-09T08:37:42Z",
    "source_hashes": {}
  },
  {
    "id": "action-380de3aedf14",
    "owner": "Hermes",
    "action": "Call a local owner-operated prospect in the business-hours batch",
    "priority": "low",
    "score": 41.0,
    "due_at": "10:00 ET next business day",
    "reason": "Owner-operated local prospects are the best next segment after large-company IVR failures.",
    "expected_revenue_path": "Better contact → reply or booked call → home-service follow-up starter sale",
    "evidence_link": "private-source-redacted",
    "status": "open",
    "source_entity_type": "prospect",
    "source_entity_id": "prospect-3e61f747558b",
    "source_paths": [
      "private-source-redacted"
    ],
    "generated_at": "2026-07-09T08:37:42Z",
    "source_hashes": {}
  },
  {
    "id": "action-6d1a8b02e11e",
    "owner": "Hermes",
    "action": "Call a local owner-operated prospect in the business-hours batch",
    "priority": "low",
    "score": 37.93,
    "due_at": "10:00 ET next business day",
    "reason": "Owner-operated local prospects are the best next segment after large-company IVR failures.",
    "expected_revenue_path": "Better contact → reply or booked call → home-service follow-up starter sale",
    "evidence_link": "private-source-redacted",
    "status": "open",
    "source_entity_type": "prospect",
    "source_entity_id": "prospect-cde585cb82c5",
    "source_paths": [
      "private-source-redacted"
    ],
    "generated_at": "2026-07-09T08:37:42Z",
    "source_hashes": {}
  },
  {
    "id": "action-1cb3346c415b",
    "owner": "Hermes",
    "action": "Call a local owner-operated prospect in the business-hours batch",
    "priority": "low",
    "score": 35.0,
    "due_at": "10:00 ET next business day",
    "reason": "Owner-operated local prospects are the best next segment after large-company IVR failures.",
    "expected_revenue_path": "Better contact → reply or booked call → home-service follow-up starter sale",
    "evidence_link": "private-source-redacted",
    "status": "open",
    "source_entity_type": "prospect",
    "source_entity_id": "prospect-b33013c73777",
    "source_paths": [
      "private-source-redacted"
    ],
    "generated_at": "2026-07-09T08:37:42Z",
    "source_hashes": {}
  },
  {
    "id": "action-5c5b6d692986",
    "owner": "Hermes",
    "action": "Call a local owner-operated prospect in the business-hours batch",
    "priority": "low",
    "score": 35.0,
    "due_at": "10:00 ET next business day",
    "reason": "Owner-operated local prospects are the best next segment after large-company IVR failures.",
    "expected_revenue_path": "Better contact → reply or booked call → home-service follow-up starter sale",
    "evidence_link": "private-source-redacted",
    "status": "open",
    "source_entity_type": "prospect",
    "source_entity_id": "prospect-bbb03a78397c",
    "source_paths": [
      "private-source-redacted"
    ],
    "generated_at": "2026-07-09T08:37:42Z",
    "source_hashes": {}
  },
  {
    "id": "action-bc62d558f2c2",
    "owner": "Hermes",
    "action": "Call a local owner-operated prospect in the business-hours batch",
    "priority": "low",
    "score": 35.0,
    "due_at": "10:00 ET next business day",
    "reason": "Owner-operated local prospects are the best next segment after large-company IVR failures.",
    "expected_revenue_path": "Better contact → reply or booked call → home-service follow-up starter sale",
    "evidence_link": "private-source-redacted",
    "status": "open",
    "source_entity_type": "prospect",
    "source_entity_id": "prospect-704b625290fb",
    "source_paths": [
      "private-source-redacted"
    ],
    "generated_at": "2026-07-09T08:37:42Z",
    "source_hashes": {}
  },
  {
    "id": "action-3238ff278c07",
    "owner": "Hermes",
    "action": "Call a local owner-operated prospect in the business-hours batch",
    "priority": "low",
    "score": 35.0,
    "due_at": "10:00 ET next business day",
    "reason": "Owner-operated local prospects are the best next segment after large-company IVR failures.",
    "expected_revenue_path": "Better contact → reply or booked call → home-service follow-up starter sale",
    "evidence_link": "private-source-redacted",
    "status": "open",
    "source_entity_type": "prospect",
    "source_entity_id": "prospect-36518a37f922",
    "source_paths": [
      "private-source-redacted"
    ],
    "generated_at": "2026-07-09T08:37:42Z",
    "source_hashes": {}
  },
  {
    "id": "action-3c47f2d6f53e",
    "owner": "Hermes",
    "action": "Call a local owner-operated prospect in the business-hours batch",
    "priority": "low",
    "score": 35.0,
    "due_at": "10:00 ET next business day",
    "reason": "Owner-operated local prospects are the best next segment after large-company IVR failures.",
    "expected_revenue_path": "Better contact → reply or booked call → home-service follow-up starter sale",
    "evidence_link": "private-source-redacted",
    "status": "open",
    "source_entity_type": "prospect",
    "source_entity_id": "prospect-d85953149f16",
    "source_paths": [
      "private-source-redacted"
    ],
    "generated_at": "2026-07-09T08:37:42Z",
    "source_hashes": {}
  },
  {
    "id": "action-0291cfdfd3f9",
    "owner": "Hermes",
    "action": "Call a local owner-operated prospect in the business-hours batch",
    "priority": "low",
    "score": 35.0,
    "due_at": "10:00 ET next business day",
    "reason": "Owner-operated local prospects are the best next segment after large-company IVR failures.",
    "expected_revenue_path": "Better contact → reply or booked call → home-service follow-up starter sale",
    "evidence_link": "private-source-redacted",
    "status": "open",
    "source_entity_type": "prospect",
    "source_entity_id": "prospect-3cc3ced82831",
    "source_paths": [
      "private-source-redacted"
    ],
    "generated_at": "2026-07-09T08:37:42Z",
    "source_hashes": {}
  },
  {
    "id": "action-01b9ec7edf0f",
    "owner": "Hermes",
    "action": "Call a local owner-operated prospect in the business-hours batch",
    "priority": "low",
    "score": 24.11,
    "due_at": "10:00 ET next business day",
    "reason": "Owner-operated local prospects are the best next segment after large-company IVR failures.",
    "expected_revenue_path": "Better contact → reply or booked call → home-service follow-up starter sale",